{
  "agent": "claude-code-session-2026-10-22",
  "blockers": [],
  "commands": [
    {
      "command": "npm run context:verify",
      "exitCode": 0,
      "observed": "0 errors on afea2f2 tree; warnings and notes listed",
      "result": "passed"
    },
    {
      "command": "npm run context:restore-check",
      "exitCode": 0,
      "observed": "22 restored + re-verified, 2 skipped (not preserved), 0 failed, live repository untouched",
      "result": "passed"
    },
    {
      "command": "node _registry/audit.js",
      "exitCode": 0,
      "observed": "ALL CONSTITUTIONAL CHECKS PASSED",
      "result": "passed"
    },
    {
      "command": "node _registry/project.js --check",
      "exitCode": 0,
      "observed": "INTEGRITY OK",
      "result": "passed"
    },
    {
      "command": "npm run registry",
      "exitCode": 0,
      "observed": "15 gate checks green, seal verified",
      "result": "passed"
    },
    {
      "command": "npm test (120d364)",
      "exitCode": 1,
      "observed": "test/context.js §F git commit on clean sandbox; regression fixed in afea2f2 — superseded by the passing run on afea2f2",
      "result": "failed"
    }
  ],
  "completed": [
    {
      "claim": "Context continuity system implemented: archive manifest + verification, schema-validated knowledge, typed graph, deterministic budgeted packs, assimilation gate + receipts, handoffs, invalidation, hygiene/lifecycle/consolidation, coverage, restore-check, CLI, AGENTS.md/CLAUDE.md, CI steps",
      "evidence": "commits 4d4e7fe, 120d364, afea2f2; test/context.js 171/171"
    },
    {
      "claim": "Audit hardening: all open issues, security/privacy/constitutional constraints and depends-on closure are mandatory; excluded knowledge blocks the gate; restore isolation measured; verify fails on unverified critical requirements and bad entry-point references",
      "evidence": "commit 120d364; re-injecting two defects turned the suite red (161/171)"
    },
    {
      "claim": "Regression found and fixed: sandbox git commit failed on a clean checkout",
      "evidence": "npm test on 120d364 exit 1 (05:49:27-05:49:43 UTC); fixed in afea2f2"
    },
    {
      "claim": "Full npm test passes on the final code commit",
      "evidence": "npm test on clean afea2f2, exit 0, 05:51:26-06:16:59 UTC, HEAD/clean tree confirmed before and after"
    },
    {
      "claim": "CI detects schema, graph, cycle, traceability, stale, drift, corruption, missing pack, checksum, secret, handoff and entry-point failures",
      "evidence": "npm run context:verify in 12 injected sandbox copies: each exit 1 with the matching diagnostic; clean copy exit 0"
    }
  ],
  "contextPacks": [
    {
      "fingerprint": "e818d511bbc30c464e0ded647a60377e66c17763181c71a2640d3fe7bdabdb03",
      "id": "CTX-CONTINUITY-SYSTEM"
    },
    {
      "fingerprint": "adab628c983b472b2b8d709dc04a20ffbae1bbb16b199e1c209e60d9b017db60",
      "id": "CTX-EVIDENCE-ARCHIVE"
    }
  ],
  "createdAt": "2026-10-22T06:18:12.394Z",
  "filesChanged": [
    ".github/workflows/ci.yml",
    ".gitignore",
    "package.json",
    "AGENTS.md",
    "CLAUDE.md",
    "lib/context/*.js",
    "scripts/context.js",
    "test/context.js",
    "PROJECT-CONTEXT/**"
  ],
  "filesInspected": [],
  "id": "HO-CTX-0001-001",
  "mustNotChange": [
    "No change to the marketplace/product runtime (lib/*.js outside lib/context, server.js, public/)",
    "No change to _registry/*.json or the constitutional projections",
    "Pre-existing defects (ISS-CANONICAL-INPUT-MISNAMED, ISS-REVIEW-FINDINGS-UNRECONCILED) are tracked, not fixed here",
    "No push, PR or deployment without owner authorisation"
  ],
  "nextAction": "Owner reviews DEC-CTX-* in PROJECT-CONTEXT/03-DECISION-REGISTER.md (TASK-CTX-0002); open a PR so CI runs the workflow remotely.",
  "notCompleted": [],
  "objective": "Give any authorised agent — any model, client or context size — a governed, verifiable path to recover the project's knowledge, continue work and hand off, with preserved evidence and measurable coverage.",
  "prerequisites": [],
  "previous": null,
  "regressions": [
    "120d364: test/context.js §F aborted npm test on clean checkouts — fixed in afea2f2"
  ],
  "repository": {
    "branch": "claude/modest-babbage-kyejdn",
    "dirty": true,
    "head": "afea2f25597a8b469ad1d48719ad4be8e56c6305",
    "status": [
      "M PROJECT-CONTEXT/00-MASTER-INDEX.md",
      " M PROJECT-CONTEXT/02-CURRENT-STATE.md",
      " M PROJECT-CONTEXT/10-CONTEXT-QUALITY-REPORT.md",
      " M PROJECT-CONTEXT/contexts/CTX-BOOTSTRAP.json",
      " M PROJECT-CONTEXT/contexts/CTX-BOOTSTRAP.md",
      " M PROJECT-CONTEXT/contexts/CTX-CONTINUITY-DESIGN.json",
      " M PROJECT-CONTEXT/contexts/CTX-CONTINUITY-DESIGN.md",
      " M PROJECT-CONTEXT/contexts/CTX-CONTINUITY-SYSTEM.json",
      " M PROJECT-CONTEXT/contexts/CTX-CONTINUITY-SYSTEM.md",
      " M PROJECT-CONTEXT/contexts/CTX-EVIDENCE-ARCHIVE.json",
      " M PROJECT-CONTEXT/contexts/CTX-EVIDENCE-ARCHIVE.md",
      " M PROJECT-CONTEXT/contexts/CTX-GOVERNANCE.json",
      " M PROJECT-CONTEXT/contexts/CTX-GOVERNANCE.md",
      " M PROJECT-CONTEXT/contexts/CTX-PLATFORM-QUALITY.json",
      " M PROJECT-CONTEXT/contexts/CTX-PLATFORM-QUALITY.md",
      " M PROJECT-CONTEXT/contexts/index.json",
      " M PROJECT-CONTEXT/knowledge/state.json",
      " M PROJECT-CONTEXT/task-packs/TASK-CTX-0001.md",
      " M PROJECT-CONTEXT/task-packs/TASK-CTX-0002.md",
      " M PROJECT-CONTEXT/task-packs/TASK-CTX-0003.md",
      " M PROJECT-CONTEXT/task-packs/TASK-REG-0001.md",
      " M PROJECT-CONTEXT/task-packs/TASK-SEC-0001.md"
    ],
    "upstream": "origin/claude/modest-babbage-kyejdn"
  },
  "schema": "ctx-handoff/1",
  "state": "done",
  "task": "TASK-CTX-0001",
  "tests": [
    {
      "command": "npm test (baseline, 441d772)",
      "exitCode": 0,
      "observed": "all suites green, ~23 min (04:58-05:21 UTC)",
      "preExisting": true,
      "result": "passed"
    },
    {
      "command": "npm test (tree committed as 4d4e7fe)",
      "exitCode": 0,
      "observed": "context 148/148, all suites green, 05:25:01-05:49:10 UTC",
      "result": "passed"
    },
    {
      "command": "npm test (afea2f2)",
      "exitCode": 0,
      "observed": "context 171/171, all suites green, 0 failed assertions, 05:51:26-06:16:59 UTC",
      "result": "passed"
    },
    {
      "command": "node test/context.js",
      "exitCode": 0,
      "observed": "171/171",
      "result": "passed"
    }
  ],
  "unverified": [
    "CI has never run remotely for this branch (no PR; workflow triggers only on push to main/master and pull_request) — all evidence is local",
    "DEC-CTX-* are agent-proposed and not owner-approved (TASK-CTX-0002)",
    "REQ-CTX-* paraphrase the owner's 2026-10-22 prompt, which is not archived (TASK-CTX-0003)",
    "Segment accounting 99.62% is dominated by corpora classified 'preserved'; only 0.27% of segments are cited by knowledge records; 23 segments remain unprocessed"
  ],
  "verification": [
    "npm run context:verify",
    "node test/context.js",
    "npm run context:restore-check",
    "npm run registry",
    "npm test"
  ]
}
