{
  "agent": "claude-code-session-2026-10-22",
  "blockers": [],
  "commands": [
    {
      "command": "node test/context.js (b18423f)",
      "exitCode": 1,
      "observed": "164/171 — HISTORICAL, superseded by 171/171 on 8207fd7",
      "result": "failed"
    },
    {
      "command": "npm run context:verify (8207fd7)",
      "exitCode": 0,
      "observed": "0 errors",
      "result": "passed"
    },
    {
      "command": "node _registry/audit.js (8207fd7)",
      "exitCode": 0,
      "observed": "ALL CONSTITUTIONAL CHECKS PASSED",
      "result": "passed"
    }
  ],
  "completed": [
    {
      "claim": "Test regression after the first handoff fixed: assertions no longer hard-code transient task state",
      "evidence": "commit 8207fd7; node test/context.js 171/171; timestamp check re-proven by injecting a build-clock timestamp (159/171 red); dependency biconditional exercised both ways"
    },
    {
      "claim": "Full npm test passes on the final code commit 8207fd7",
      "evidence": "npm test on clean 8207fd7, exit 0, 06:20:14-06:45:25 UTC, HEAD/clean tree confirmed before and after; 0 failed assertions; warnings identical to baseline"
    },
    {
      "claim": "CI command detects all 12 injected failure classes",
      "evidence": "npm run context:verify in disposable copies of 8207fd7: 12 injections exit 1 with the matching diagnostic, clean control exit 0; live tree unchanged"
    }
  ],
  "contextPacks": [
    {
      "fingerprint": "690abed1b08ebe13076863b4cf42201bedbee6e3097fb47f84624cdf91420e93",
      "id": "CTX-CONTINUITY-SYSTEM"
    },
    {
      "fingerprint": "adab628c983b472b2b8d709dc04a20ffbae1bbb16b199e1c209e60d9b017db60",
      "id": "CTX-EVIDENCE-ARCHIVE"
    }
  ],
  "createdAt": "2026-10-22T06:47:02.950Z",
  "filesChanged": [
    "test/context.js",
    "PROJECT-CONTEXT/knowledge/state.json",
    "PROJECT-CONTEXT/handoffs/HO-CTX-0001-002.json",
    "PROJECT-CONTEXT (regenerated views and packs)"
  ],
  "filesInspected": [],
  "id": "HO-CTX-0001-002",
  "mustNotChange": [
    "No change to the marketplace/product runtime (lib/*.js outside lib/context, server.js, public/)",
    "No change to _registry/*.json or the constitutional projections",
    "Pre-existing defects (ISS-CANONICAL-INPUT-MISNAMED, ISS-REVIEW-FINDINGS-UNRECONCILED) are tracked, not fixed here",
    "No push, PR or deployment without owner authorisation"
  ],
  "nextAction": "Owner reviews DEC-CTX-* in PROJECT-CONTEXT/03-DECISION-REGISTER.md (TASK-CTX-0002); open a PR so CI runs the workflow remotely.",
  "notCompleted": [],
  "objective": "Give any authorised agent — any model, client or context size — a governed, verifiable path to recover the project's knowledge, continue work and hand off, with preserved evidence and measurable coverage.",
  "prerequisites": [],
  "previous": "HO-CTX-0001-001",
  "regressions": [
    "HISTORICAL, fixed in afea2f2: 120d364 npm test exit 1 (sandbox git commit on clean checkout)",
    "HISTORICAL, fixed in 8207fd7: b18423f test/context.js 164/171 (state-coupled assertions)"
  ],
  "repository": {
    "branch": "claude/modest-babbage-kyejdn",
    "dirty": true,
    "head": "8207fd70098fd838a94fd9cd23855ef955a7bf7c",
    "status": [
      "M PROJECT-CONTEXT/knowledge/state.json"
    ],
    "upstream": "origin/claude/modest-babbage-kyejdn"
  },
  "schema": "ctx-handoff/1",
  "state": "done",
  "task": "TASK-CTX-0001",
  "tests": [
    {
      "command": "npm test (8207fd7)",
      "exitCode": 0,
      "observed": "context 171/171, all suites green, 0 failed, 06:20:14-06:45:25 UTC",
      "result": "passed"
    },
    {
      "command": "node test/context.js (8207fd7)",
      "exitCode": 0,
      "observed": "171/171",
      "result": "passed"
    }
  ],
  "unverified": [
    "CI has never run remotely for this branch: no PR exists and the workflow triggers only on push to main/master and pull_request (GitHub API: 0 workflow runs for the branch)",
    "DEC-CTX-* remain agent-proposed, not owner-approved (TASK-CTX-0002)",
    "The owner's 2026-10-22 prompt is not archived; REQ-CTX-* paraphrase it (TASK-CTX-0003)",
    "Segment representation is 0.27% (16/6006); 23 in-scope segments unprocessed",
    "The full-suite result for the commit that adds this handoff is reported outside it (a record cannot contain the result of testing itself)"
  ],
  "verification": [
    "npm run context:verify",
    "node test/context.js",
    "npm run context:restore-check",
    "npm run registry",
    "npm test"
  ]
}
